{
  "schema_version": 1,
  "updated": "2026-08-02",
  "purpose": "Fail-closed inventory for every tradition and engine branch named in the original culture map.",
  "status_vocabulary": {
    "production_verified": "Calculation, interpretation, provenance, validation, rights, cultural review, and publication gates all pass.",
    "research_verified": "Authoritative or scholarly sources have been inspected and the stated research artifact or design boundary is reproducible, but production gates remain open.",
    "experimental": "A bounded implementation exists but validation or source authority is insufficient for research_verified status.",
    "source_limited": "The surviving or currently accessible corpus cannot yet justify the complete proposed module.",
    "not_implemented": "The module is enumerated but no implementation is claimed or simulated."
  },
  "implementation_states": [
    "validated_research_artifact",
    "source_design_only",
    "source_discovery_only",
    "none"
  ],
  "global_product_boundary": {
    "western_engine_live": true,
    "nonwestern_live_engines": [],
    "nonwestern_customer_eligible_modules": [],
    "historical_use_only_required": true,
    "prose_may_invent_missing_rules": false,
    "missing_modules_must_be_reported": true
  },
  "coverage_counts_are_not_completion": "A module is complete only at production_verified. A research_verified calendar kernel does not imply an interpretation engine, and a source audit does not imply executable rules.",
  "tracks": [
    {
      "track_id": "indian_jyotisha",
      "display_name": "Indian Jyotisha",
      "registry_tradition_ids": [
        "indian_jyotisha"
      ],
      "source_audit": "jyotisha/source_audit.md",
      "overall_status": "research_verified",
      "live_engine": false,
      "customer_eligible": false,
      "modules": [
        {
          "module_id": "brhajjataka_classical_jataka",
          "name": "Varahamihira Brhajjataka calculation and planetary-condition pilot",
          "input_kind": "birth_datetime_location",
          "birth_input_eligible": true,
          "coverage_status": "research_verified",
          "implementation_state": "validated_research_artifact",
          "artifacts": [
            "jyotisha/brhajjataka_calculation_rule_manifest.json",
            "jyotisha/brhajjataka_validation_vectors.json",
            "jyotisha/brhajjataka_planetary_rule_manifest.json",
            "jyotisha/brhajjataka_planetary_validation_vectors.json"
          ],
          "remaining_gates": [
            "controlling Sanskrit edition collation",
            "independent Sanskrit review",
            "complete natal procedure",
            "astronomical convention freeze"
          ]
        },
        {
          "module_id": "parashari_natal",
          "name": "Parashari natal framework including houses, yogas, vargas, and dashas",
          "input_kind": "birth_datetime_location",
          "birth_input_eligible": true,
          "coverage_status": "source_limited",
          "implementation_state": "source_design_only",
          "artifacts": [
            "jyotisha/source_audit.md"
          ],
          "remaining_gates": [
            "BPHS recension selection",
            "passage-complete rule extraction",
            "ayanamsha and node convention",
            "worked-chart validation"
          ]
        },
        {
          "module_id": "saravali_natal",
          "name": "Kalyanavarma Saravali natal pack",
          "input_kind": "birth_datetime_location",
          "birth_input_eligible": true,
          "coverage_status": "source_limited",
          "implementation_state": "source_discovery_only",
          "artifacts": [
            "jyotisha/source_audit.md"
          ],
          "remaining_gates": [
            "controlling edition collation (Sanskrit original is public domain; a modern translation is a convenience, not a gate)",
            "Sanskrit review",
            "rule and precedence extraction"
          ]
        },
        {
          "module_id": "phaladeepika_natal",
          "name": "Mantreswara Phaladeepika natal pack",
          "input_kind": "birth_datetime_location",
          "birth_input_eligible": true,
          "coverage_status": "research_verified",
          "implementation_state": "validated_research_artifact",
          "artifacts": [
            "jyotisha/source_audit.md",
            "jyotisha/delineation_rule_manifest.json"
          ],
          "remaining_gates": [
            "Phaladeepika 1950 translation rights unresolved; treated as internal paraphrase research only, matching the existing Brhajjataka translation posture",
            "independent Sanskrit review of every extracted rule (the scan's own embedded Devanagari is OCR-corrupted and could not independently control wording)",
            "Sun's Adhyaya VIII houses 1-5, 7 and 8 not recovered from this OCR pass; needs a page-image check",
            "house-from-the-Moon and house-from-the-Sun relative reckoning not yet computed by the engine, so Sunapha/Anapha/Durudhara/Kemadruma, Kesari/Sakata, Adhama/Sama/Varishtha, and the Sun-relative Vesi/Vaasi yogas are sourced but not yet checkable against live chart facts",
            "no worked natal chart with the author's own stated verdict was found in the inspected chapters (VI-VIII, XIX); the pack is a rule catalog, not a worked-example reproduction",
            "composer/engine wiring of the sourced rules onto computed facts (no engine or composer code was written in this research pass)"
          ]
        }
      ]
    },
    {
      "track_id": "chinese_bazi",
      "display_name": "Chinese BaZi / Four Pillars",
      "registry_tradition_ids": [
        "chinese",
        "chinese_bazi"
      ],
      "source_audit": "bazi/source_audit.md",
      "overall_status": "research_verified",
      "live_engine": false,
      "customer_eligible": false,
      "modules": [
        {
          "module_id": "bazi_calendar_kernel",
          "name": "Four Pillars calendar and solar-term calculation profile",
          "input_kind": "birth_datetime_location",
          "birth_input_eligible": true,
          "coverage_status": "research_verified",
          "implementation_state": "validated_research_artifact",
          "artifacts": [
            "bazi/source_audit.md",
            "bazi/sexagenary_kernel_spec.json",
            "bazi/sexagenary_rule_manifest.json",
            "bazi/sexagenary_validation_vectors.json"
          ],
          "remaining_gates": [
            "named day-count concordance source with two-sided boundary vectors",
            "named school convention profile for year, month, day, and hour boundaries",
            "true-solar-time and historical-time lineage attribution",
            "independent almanac conformance"
          ]
        },
        {
          "module_id": "yuanhai_ziping_interpretation",
          "name": "Yuanhai Ziping interpretation pack",
          "input_kind": "birth_datetime_location",
          "birth_input_eligible": true,
          "coverage_status": "source_limited",
          "implementation_state": "source_discovery_only",
          "artifacts": [
            "bazi/source_audit.md"
          ],
          "remaining_gates": [
            "dated scan alignment",
            "Chinese textual review",
            "school-specific precedence rules"
          ]
        },
        {
          "module_id": "sanming_tonghui_interpretation",
          "name": "Sanming Tonghui interpretation pack",
          "input_kind": "birth_datetime_location",
          "birth_input_eligible": true,
          "coverage_status": "source_limited",
          "implementation_state": "source_discovery_only",
          "artifacts": [
            "bazi/source_audit.md"
          ],
          "remaining_gates": [
            "edition and interpolation control",
            "Chinese review",
            "complete combination and exception hierarchy"
          ]
        }
      ]
    },
    {
      "track_id": "ziwei_doushu",
      "display_name": "Zi Wei Dou Shu",
      "registry_tradition_ids": [
        "ziwei_doushu",
        "ziwei_doushu_source_criticism",
        "daoist_star_astrology"
      ],
      "source_audit": "ziwei/source_audit.md",
      "overall_status": "research_verified",
      "live_engine": false,
      "customer_eligible": false,
      "modules": [
        {
          "module_id": "ziwei_named_edition_chart",
          "name": "Named-edition palace and star-placement calculator",
          "input_kind": "birth_datetime_location",
          "birth_input_eligible": true,
          "coverage_status": "research_verified",
          "implementation_state": "validated_research_artifact",
          "artifacts": [
            "ziwei/calculation_rule_manifest.json",
            "ziwei/validation_vectors.json"
          ],
          "remaining_gates": [
            "complete table transcription",
            "calendar convention freeze",
            "independent chart comparison"
          ]
        },
        {
          "module_id": "ziwei_interpretation",
          "name": "Palace, star, transformation, and timing interpretation",
          "input_kind": "birth_datetime_location",
          "birth_input_eligible": true,
          "coverage_status": "source_limited",
          "implementation_state": "source_design_only",
          "artifacts": [
            "ziwei/source_audit.md"
          ],
          "remaining_gates": [
            "named school and edition",
            "complete primary text",
            "Chinese review",
            "combination precedence"
          ]
        }
      ]
    },
    {
      "track_id": "mesopotamian_babylonian",
      "display_name": "Mesopotamian and Babylonian Astrology",
      "registry_tradition_ids": [
        "mesopotamian_babylonian"
      ],
      "source_audit": "babylonian/source_audit.md",
      "overall_status": "research_verified",